[
  {
    "enabled": true,
    "logging": true,
    "maxDecryptDepth": 2,
    "name": "Example deep crawl",
    "pattern": "https?://(?:www\\.)?example\\.org/releases/[^?#]+",
    "rule": "DEEPDECRYPT",
    "packageNamePattern": "<title>([^<]+)</title>",
    "passwordPattern": null,
    "formPattern": null,
    "deepPattern": "(https?://[^\\\"'<>\\\\s]+)",
    "rewriteReplaceWith": null,
    "cookies": null,
    "updateCookies": null
  },
  {
    "enabled": true,
    "logging": true,
    "maxDecryptDepth": 1,
    "name": "Example direct HTTP",
    "pattern": "https?://downloads\\.example\\.org/files/[^?#]+",
    "rule": "DIRECTHTTP",
    "packageNamePattern": null,
    "passwordPattern": null,
    "formPattern": null,
    "deepPattern": null,
    "rewriteReplaceWith": null,
    "cookies": null,
    "updateCookies": null
  },
  {
    "enabled": true,
    "logging": true,
    "maxDecryptDepth": 1,
    "name": "Example follow redirect",
    "pattern": "https?://example\\.org/go/[^?#]+",
    "rule": "FOLLOWREDIRECT",
    "packageNamePattern": null,
    "passwordPattern": null,
    "formPattern": null,
    "deepPattern": null,
    "rewriteReplaceWith": null,
    "cookies": null,
    "updateCookies": null
  },
  {
    "enabled": true,
    "logging": true,
    "maxDecryptDepth": 1,
    "name": "Example rewrite",
    "pattern": "https?://example\\.org/old/(.+)",
    "rule": "REWRITE",
    "packageNamePattern": null,
    "passwordPattern": null,
    "formPattern": null,
    "deepPattern": null,
    "rewriteReplaceWith": "https://example.org/new/$1",
    "cookies": null,
    "updateCookies": null
  },
  {
    "enabled": true,
    "logging": true,
    "maxDecryptDepth": 1,
    "name": "Example submit form",
    "pattern": "https?://example\\.org/form/[^?#]+",
    "rule": "SUBMITFORM",
    "packageNamePattern": null,
    "passwordPattern": null,
    "formPattern": "<form[^>]*>(.*?)</form>",
    "deepPattern": null,
    "rewriteReplaceWith": null,
    "cookies": null,
    "updateCookies": null
  }
]
